{
  "intent_hash": "0xINTENT_HASH_PLACEHOLDER",
  "status": "pass",
  "checks": [
    {
      "name": "chain_id",
      "status": "pass",
      "evidence": {
        "expected": "SN_SEPOLIA",
        "observed": "SN_SEPOLIA"
      }
    },
    {
      "name": "rpc_allowlist",
      "status": "pass",
      "evidence": {
        "rpc": "https://starknet-sepolia.g.alchemy.com/v2/<API_KEY>"
      }
    },
    {
      "name": "signer_allowlist",
      "status": "pass",
      "evidence": {
        "signer_alias": "SEPOLIA_DEPLOY_SW_A"
      }
    },
    {
      "name": "class_hash",
      "status": "pass",
      "evidence": {
        "expected": "0xCLASS_HASH",
        "observed": "0xCLASS_HASH"
      }
    },
    {
      "name": "post_deploy_snapshot",
      "status": "skip",
      "evidence": {
        "reason": "toy example"
      }
    }
  ],
  "meta": {
    "generated_at": "2026-02-04T00:00:00Z"
  }
}